Title,Year,Source title,Author Keywords,Index Keywords,Affiliations
single-position oblique lumbar interbody fusion and percutaneous pedicle screw fixation under o-arm navigation: a retrospective comparative study,2023,Journal of Clinical Medicine,C-arm; minimally invasive surgery; O-arm navigation; oblique lateral lumbar interbody fusion; spinal fusion,adult; Article; clinical article; clinical outcome; Cobb angle; comparative study; controlled study; degenerative disease; female; human; hypesthesia; male; middle aged; minimally invasive surgery; Oswestry Disability Index; outcome assessment; posterior lumbar interbody fusion; postoperative complication; radicular pain; radiological parameters; retrospective study; Short Form 36; spine fusion; spine stabilization; surgical infection; visual analog scale,"Department of Neurosurgery, Daejin Medical Center, Seongnam, Gyeonggi-do, South Korea; Department of Neurosurgery, Kwandong University, College of Medicine, Gangneung, Gangwon-do, South Korea; Department of Neurosurgery, Severance Hospital, Seoul, South Korea"
"anterior column reconstruction of the lumbar spine in the lateral decubitus position: anatomical and patient-related considerations for alif, anterior-to-psoas, and transpsoas llif approaches",2022,European Spine Journal,Anterior to psoas (ATP)/OLIF; Circumferential fusion; Lateral ALIF; Minimally invasive spine surgery; Single-position lumbar fusion; Transpsoas/XLIF,anatomy and histology; diagnostic imaging; human; lumbar vertebra; lumbosacral region; procedures; reconstructive surgery; spine fusion; surgery; treatment outcome; Humans; Lumbar Vertebrae; Lumbosacral Region; Reconstructive Surgical Procedures; Spinal Fusion; Treatment Outcome,"NYU Langone Orthopedic Hospital, New York, NY, United States; Department of Neurosurgery, NYU Langone Health, New York, NY, United States; Austin Spine Surgery, Austin, TX, United States; Atlantic Neurosurgical and Spine Specialists, Wilmington, NC, United States; Oklahoma Sports Science and Orthopaedics, Oklahoma City, OK, United States; Division of Spine Surgery, New England Baptist Hospital, Boston, MA, United States"
oblique lateral interbody fusion vs. minimally invasive transforaminal lumbar interbody fusion for lumbar spinal stenosis: a retrospective cohort study,2022,Frontiers in Medicine,lumbar spinal stenosis; Minimally Invasive Transforaminal Lumbar Interbody Fusion (MIS-TLIF); oblique lateral interbody fusion (OLIF); postoperative improvements; retrospective study,adult; Article; clinical evaluation; cohort analysis; controlled study; female; hospitalization; human; Japanese Orthopedic Association score; lumbar spinal stenosis; major clinical study; male; middle aged; minimally invasive surgery; oblique lateral interbody fusion; operation duration; operative blood loss; Oswestry Disability Index; posterior lumbar interbody fusion; postoperative complication; reoperation; retrospective study; Short Form 36; spine fusion; visual analog scale,"Department of Orthopaedics, Tangdu Hospital, Fourth Military Medical University, Xi'an, Shaanxi, China; School of Basic Medicine, Air Force Medical University, Xi'an, Shaanxi, China"
mri study to evaluate anatomic oblique lumbar interbody fusion corridor in indian population,2021,Journal of Minimally Invasive Spine Surgery and Technique,Anatomical corridor; Bare window; Oblique corridor; Oblique lumbar interbody fusion,,"Department of Spine Surgery, Chirayu Orthopedic Fracture and Spine Hospital, Ahmedabad, India; Department of Orthopaedic Surgery, Chirayu Orthopedic Fracture and Spine Hospital, Ahmedabad, India"
article clinical evaluation of microendoscopy-assisted oblique lateral interbody fusion,2021,Medicina (Lithuania),Extreme lateral interbody fusion (XLIF); Lumbar lateral interbody fusion (LLIF); Microendscope; Minimally invasive surgery; Oblique lateral interbody fusion (OLIF),adverse event; diagnostic imaging; human; lumbar vertebra; lumbosacral region; quality of life; retrospective study; spine fusion; surgery; treatment outcome; Humans; Lumbar Vertebrae; Lumbosacral Region; Quality of Life; Retrospective Studies; Spinal Fusion; Treatment Outcome,"Department of Orthopaedics, Iwai Orthopaedic Medical Hospital, Edogawa City, Japan; Department of Neurosurgery, Iwai FESS Clinic, Edogawa City, Japan"
"perioperative complications in 155 patients who underwent oblique lateral interbody fusion surgery perspectives and indications from a retrospective, multicenter survey",2017,Spine,Complication; Direct lateral interbody fusion; Extreme lateral interbody fusion; Lower back pain; Lumbar lateral interbody fusion; Oblique lateral interbody fusion,"adolescent; adult; aged; artery injury; Article; cauda equina injury; discogenic pain; endplate fracture; female; human; intervertebral disk degeneration; kyphoscoliosis; laceration; low back pain; major clinical study; male; medical record review; multicenter study; muscle weakness; nerve root injury; neurologic disease; oblique lateral interbody fusion surgery; paresthesia; peritoneal disease; peritoneal laceration; peroperative complication; pleura disease; pleura laceration; postoperative complication; postoperative infection; priority journal; prosthesis failure; psoas muscle; reoperation; secondary analysis; spinal cord atrophy; spinal nerve injury; spine fusion; spine fusion implant; spondylolisthesis; surgical infection; surgical mortality; thigh; ureter injury; clinical trial; incidence; Intervertebral Disc Degeneration; Intraoperative Complications; lumbar vertebra; middle aged; Postoperative Complications; postoperative period; procedures; retrospective study; treatment outcome; very elderly; young adult; Adolescent; Adult; Aged; Aged, 80 and over; Female; Humans; Incidence; Low Back Pain; Lumbar Vertebrae; Male; Middle Aged; Postoperative Period; Reoperation; Retrospective Studies; Spinal Fusion; Treatment Outcome; Young Adult","Department of Orthopaedic Surgery, Chiba University, Chiba, Chiba, Japan; Department of Orthopaedic Surgery, Chiba Aoba Municipal Hospital, Chiba, Chiba, Japan; Department of Orthopaedic Surgery, Teikyo University Chiba Medical Center, Ichihara, Chiba, Japan; Department of Orthopaedic Surgery, Sanmu Medical Center, Naruto, Chiba, Japan; Department of Orthopaedic Surgery, Seirei Sakura Citizen Hospital, Sakura, Chiba, Japan; Department of Orthopaedic Surgery, Kashiwa Municipal Hospital, Kashiwa, Chiba, Japan; Department of Orthopaedic Surgery, Kimitsu Chuo Hospital, Kisarazu, Chiba, Japan; Department of Orthopaedic Surgery, Chiba Rosai Hospital, Ichihara, Chiba, Japan; Department of Orthopaedic Surgery, Asahi General Hospital, Asahi, Chiba, Japan; Department of Orthopaedic Surgery, National Hospital Organization Shimoshizu National Hospital, Yotsukaido, Chiba, Japan; Department of Orthopaedic Surgery, JCHO Chiba Hospital, Chiba, Chiba, Japan; Department of Bioenvironmental Medicine, Chiba University, Chiba, Chiba, Japan; Department of Orthopaedic Surgery, Back Center Back Pain Spine Surgery, Melbourne, FL, United States; Department of Orthopaedic Surgery, Eastern Chiba Medical Center, Togane, Chiba, Japan"
